{
  "schema": "news.dedup/v1",
  "message_id": "01M47X6FV8Z551ZDA9KBFBG5CZ",
  "produced_at": "2026-10-06T06:07:45Z",
  "producer": {
    "service": "news-dedup",
    "version": "1.0.0",
    "job_id": "01J9N3A4K8R2T7V5X0M6C1D9HF"
  },
  "type": "verdict",
  "item_id": "6ab9e5cd-8576-5663-b415-428ade46e6f9",
  "idempotency_key": "news:article:e7a41b09c35d28f6a1d0b94c7e3f5a82d6c1b0e947f3a5d82c6b1e0a49d7f315",
  "story_id": "01J9N4W6C2R8T5K1V7X3M0DPZA",
  "is_origin": true,
  "duplicate_of": null,
  "cluster_size": 5,
  "version": 1,
  "rank_in_cluster": 1,
  "origin_source_id": "3c7f9d52-1e4a-4b86-a0d3-7b2e5c8f1a90",
  "origin_time": "2026-10-06T05:41:00Z",
  "matched_by": null,
  "hamming_distance": null,
  "title_overlap": null,
  "source_id": "3c7f9d52-1e4a-4b86-a0d3-7b2e5c8f1a90",
  "decided_at": "2026-10-06T06:07:44Z",
  "provenance": {
    "route": "green",
    "vendor": null,
    "service": "news-article-extractor",
    "fetched_at": "2026-10-06T06:05:10Z"
  },
  "retention_class": "news_excerpt"
}
